{
  "$schema": "https://json-schema.org/draft/2020-12/schema",
  "$id": "https://defenseclaw.io/schemas/scan-result.json",
  "title": "DefenseClaw Scan Result",
  "description": "Canonical scanner output — what skill-scanner / mcp-scanner / plugin-scanner / aibom / codeguard serialize as the CLI `--output json` payload and what gets persisted to audit.scan_results.raw_output. v7 extends the Finding shape with rule_id + line_number for SIEM-safe grouping, and extends the envelope with the provenance quartet.",
  "type": "object",
  "required": ["scanner", "target", "timestamp", "findings"],
  "properties": {
    "scanner":   {
      "type": "string",
      "description": "Source of the scan. Classic scanner invocations use skill|mcp|plugin|aibom|codeguard (or their *-scanner aliases). Runtime finding emitters fanned out via EmitInspectFindings use hook-rules|inline-codeguard|ai-defense|asset-policy|tool-call-inspect|inspect-http|guardrail-llm|mid-stream|rescan.",
      "enum": [
        "skill", "mcp", "plugin", "aibom", "codeguard",
        "skill-scanner", "mcp-scanner", "plugin-scanner",
        "hook-rules", "inline-codeguard", "ai-defense", "asset-policy",
        "tool-call-inspect", "inspect-http", "guardrail-llm", "mid-stream", "rescan"
      ]
    },
    "target":    { "type": "string" },
    "timestamp": { "type": "string", "format": "date-time" },
    "duration":  { "type": ["string", "null"] },
    "scan_id":   { "type": ["string", "null"], "description": "v7 correlation id shared with gateway-event-envelope EventScan + child EventScanFinding events." },

    "schema_version": { "type": ["integer", "null"], "minimum": 7 },
    "content_hash":   { "type": ["string", "null"] },
    "generation":     { "type": ["integer", "null"], "minimum": 0 },
    "binary_version": { "type": ["string", "null"] },

    "agent_id":            { "type": ["string", "null"] },
    "agent_instance_id":   { "type": ["string", "null"] },
    "sidecar_instance_id": { "type": ["string", "null"] },

    "findings": {
      "type": "array",
      "items": {
        "type": "object",
        "required": ["id", "severity", "title", "scanner"],
        "properties": {
          "id":          { "type": "string" },
          "severity":    { "type": "string", "enum": ["CRITICAL", "HIGH", "MEDIUM", "LOW", "INFO"] },
          "title":       { "type": "string" },
          "description": { "type": ["string", "null"] },
          "location":    { "type": ["string", "null"] },
          "remediation": { "type": ["string", "null"] },
          "scanner":     { "type": "string" },
          "tags":        { "type": ["array", "null"], "items": { "type": "string" } },
          "rule_id":     { "type": ["string", "null"], "description": "v7 — stable detection rule identifier for SIEM group-by." },
          "line_number": { "type": ["integer", "null"], "minimum": 0, "description": "v7 — 1-based source line; 0 or null when not meaningful." },
          "category":    { "type": ["string", "null"] },
          "confidence":  { "type": ["number", "null"], "minimum": 0, "maximum": 1 }
        },
        "additionalProperties": false
      }
    }
  },
  "additionalProperties": false
}
